Id|Date|Title|Text|
13|28 de octubre de 2019, 11:55|AMLO pide a militantes de Morena no dejarse manipular| El presidente Andrés Manuel López Obrador aseguró que ya no hay “borregos” ni ciudadanos “imaginarios” a quienes los partidos llevaban a votar para hacer ganar elecciones. Cuestionado acerca de que ayer en la asamblea de Morena en Naucalpan se descubrió que a militantes se les daba un papel para recordarles que debían votar por la actual dirigente, Yeidckol Polevnsky, el presidente López Obrador dijo que antes pudo haber sucedido esto, pero en los partidos —consideró— ya no puede haber esas prácticas. “Pueden hacer eso, aceptando sin conceder, porque no tengo elementos para juzgar y además ni debería meterme, pero sí es importante la reflexión de fondo. Ya no hay ciudadanos imaginarios, ya no hay borregos: ¿a dónde van? ¿por quién votar?”, dijo López Obrador mientras hacia una onomatopeya de un borrego. “Ya no hay eso. Un aplauso por la politización que hay en nuestro pueblo. Eso es lo más importante, es en lo que más hemos avanzado". “Si no fuese así yo estaría en el piso, porque los conservadores no se resignan, se resisten, no aceptan los cambios, siguen atacando un día sí y el otro también, y la gente nos apoya y por eso nos mantenemos. Es otra realidad”, dijo López Obrador.  jmonroy@eleconomista.com.mx  |
14|24 de octubre de 2019, 23:52|Senadores detienen cobro por el derecho al uso de agua| El pleno del Senado de la República aprobó en lo general y lo particular la Ley Federal de Derechos para el siguiente año, en donde se le corrigió la plana a lo aprobado la semana pasada en San Lázaro. Con letreros de “Morena sí apoya al campo”, los legisladores de dicha bancada echaron para atrás la modificación hecha en la Cámara de Diputados para cobrar el derecho al uso del agua al sector agrícola, con 61 votos a favor, 38 en contra y cero abstenciones. Al cierre de esta edición, aún faltaba discutir y votar en el pleno del Senado los dictámenes de Miscelánea Fiscal y de la Ley de Ingresos de la Federación 2020. Durante la discusión, la bancada de Morena presentó una reserva para eliminar la modificación que fue propuesta por el diputado Javier Lamarque, del mismo partido, tras las críticas de la oposición. “No estamos pintados en la pared para aprobar ocurrencias”, aseveró la senadora morenista Lilly Téllez, quien presentó una de las reservas. Después el legislador José Narro, del mismo partido, presentó una modificación en el mismo tenor. Senadores de la oposición celebraron la reserva presentada, la cual fue aceptada por unanimidad por los legisladores de la Cámara Alta. “Qué poco conocimiento tienen (algunos funcionarios) de la realidad de los campesinos (...) Celebro, ya vi que Morena sí apoya al campo. Súbanle impuestos a quien en verdad no paga”, dijo la senadora de Partido Acción Nacional Xóchitl Gálvez, quien al final sostuvo un cartel que decía: “Lo conseguimos, no hay impuestos al agua”. El pleno del Senado de la República aprobó las reservas presentadas por la senadora de Morena Freyda Villegas a los artículos 8, 11, 12 y 18-A de la Ley Federal de Derechos, respecto al tema de derechos migratorios. De acuerdo con el dictamen enviado por la Cámara de Diputados, el artículo 8 contemplaba el cobro a visitantes sin permiso para trabajar, por un monto de 855 pesos, mientras que la reserva de la senadora eliminó este monto y lo mantuvo en la tarifa actual, de 558 pesos. Además, el artículo 11 se modificó para la exención de pago de derechos por servicios migratorios, cuando los visitantes sin permiso para trabajar ingresen al territorio nacional por vía terrestre y su estancia en el país no exceda siete días. Respecto al cobro por la prestación de servicios a visitantes extranjeros que abandonen el territorio mexicano, la senadora presentó una modificación al artículo 12, para que el cobro pase de 77.91 pesos que dicta la ley actual en 149 pesos. La minuta entregada por San Lázaro proponía un aumento a 380 pesos. Otra reserva fue al artículo 18-A, en donde los diputados acordaron que los ingresos que se obtuvieran por la recaudación del derecho establecido a visitantes sin permiso para trabajar, con fines turísticos, se destinará 18% al Instituto Nacional de Migración (INM), 2 % a la Comisión Mexicana de Ayuda a Refugiados y 80% para proyectos en infraestructura turística que determina el gobierno federal. Sin embargo, la Cámara Alta aprobó que se destine 20% al INM y 80% al gobierno federal, para proyectos de infraestructura. Al cierre de esta edición, los dictámenes de Ley de Ingresos de la Federación (LIF) y Miscelánea Fiscal para el 2020 no habían sido discutidas en el pleno del Senado de la República. Sin embargo, se esperan reservas sobre los coches chocolate, economía digital y responsabilidad solidaria, entre otras. De acuerdo con lo dicho por Ricardo Monreal, de Morena, la bancada presentaría un total de 11 reservas distribuidas en los cuatro dictámenes que se votarían en el pleno. En primer lugar, dijo, eliminar la modificación sobre la regularización de los autos chocolate, ello tras las críticas que hizo la industria automotriz y otros legisladores. Otro punto que refirió fue que presentarían reserva sobre la responsabilidad solidaria en delitos fiscales para accionistas, administradores o gerentes, en donde se iban a limitar los supuestos por los que estos puedan ser responsables solidarios. Sobre economía digital, refirió que es importante modificar las tasas de retención aplicables a los ingresos que aprobaron los diputados, ya que “son elevadas y podrían incrementar el pago del ISR a los contribuyentes”. Además, Morena propondría un transitorio a la LIF para que los adeudos al IMSS, a cargo de las entidades federativas, sean regularizados mediante un convenio de pago a parcialidades. En cuanto a los candados para la reducción de ISR a ejidos o comunidades agrícolas, proponen modificarlos, ya que los aprobados por los diputados impiden a los ejidatarios y comuneros, así como ejidos y comunidades, que apliquen los beneficios. Otra modificación sería el séptimo transitorio de la LIF, ya que no es claro en cuanto al contenido de los lineamientos que debería emitir la Secretaría de Hacienda. Además, busca eliminar un transitorio que podría impulsar una cultura de no pago en detrimento a las finanzas de la CFE, al promover la negociación de pagos atrasados por parte de los estados y municipios. Por último, precisó otra modificación en la carátula de ingresos, ya que al ser eliminado el cobro por el uso de agua a campesinos —que se estimaba en una recaudación de 585 millones de pesos— se deben ajustar los ingresos, aunque esto sería mínimo. Tras la aprobación de los tres dictámenes que fueron modificados en la Cámara Alta, éstos deberán ser enviados de nuevo a la Cámara de Diputados para que aprueben las enmiendas. En San Lázaro ya no pueden hacer  modificaciones. En el caso de la Ley de Ingresos sobre Hidrocarburos, ésta se remite al Ejecutivo para su publicación en el Diario Oficial. Los cuatro dictámenes relacionados con el paquete fiscal 2020  generaron discusión en el pleno del Senado en estos aspectos: El pleno del Senado de la República aprobó sin cambio alguno, en lo particular y lo general, la Ley de Ingresos sobre Hidrocarburos. Con 67 votos a favor, 42 en contra y cero abstenciones, los legisladores de la cámara alta aceptaron reducir la carga fiscal de Petróleos Mexicanos (Pemex) para el siguiente año. Al ser aprobada por el Senado, la Ley de Ingresos sobre Hidrocarburos se remitió al Ejecutivo federal. Cabe destacar que no hubo posicionamientos en contra de la ley. Esta ley flexibiliza el régimen fiscal de Pemex para que entregue menos recursos al gobierno y, de esta manera, destine más dinero a la inversión. Así, el siguiente año la tasa del Derecho por Utilidad Compartida (DUC) que paga la petrolera pasará de 65 a 58 por ciento. Para el 2021, se espera que la tasa llegue a 54 por ciento. “Aplaudimos que el Ejecutivo busque reducir la carga fiscal a empresas de Pemex. Celebramos que los legisladores estimen conveniente la propuesta del Ejecutivo para mejorar el orden jurídico en materia de hidrocarburos, dado que la medida producirá ahorros para la petrolera”, indicó la senadora del PT Cecilia Pinedo Alonso. En su momento, Arturo Herrera, secretario de Hacienda, explicó que el apoyo fiscal para Pemex en el 2020 será por 86,000 millones de pesos;  46,000 millones de pesos son de capitalización y provienen del Presupuesto de Egresos. (B. Saldívar y M. Velázquez)  |
15|24 de octubre de 2019, 14:06|Diputados de Morena piden al Senado mantener cobro de agua y más impuestos a comida chatarra|                 Diputados de Morena hicieron un llamado al Senado de la República para que, en la discusión de la Ley de Ingresos de la Federación (LIF) 2020 mantengan el cobro del uso de agua a productores, que se reconsidere la propuesta original del cobro de impuestos a productos que dañan la salud y que se pueda condonar en 50% la deuda que tienen los municipios en electricidad. Alfonso Ramírez Cuéllar, presidente de la Comisión de Presupuesto y Cuenta Pública de la Cámara de Diputados, dijo que la propuesta de reforma a la Ley Federal de Derechos para el cobro del uso de agua al sector pecuario y agropecuario no afectará a los productores medianos ni pequeños. “El 99.9% de los productores pequeños y medianos queda totalmente a salvo. Hasta 100 hectáreas de riego no tienen absolutamente ningún problema, toda el agua concesionada no paga nada”, reiteró en una conferencia desde la Cámara de Diputados. Indicó que actualmente la recaudación que se obtiene por el cobro del uso del agua es apenas de 1 millón de pesos al año, y con este cambio se obtendrían alrededor de 500 millones de pesos. “Lo que queremos es que empiece a haber gobierno en el agua, los que están protestando son un grupo de millonarios que se roban el agua (…) los recursos se utilizarán para infraestructura hidráulica”. Por otra parte, la diputada federal Laura Imelda Pérez, apuntó que presentará una reserva al Senado del artículo 2 de la Ley del Impuesto Especial sobre Producción y Servicios (IEPS) para modificar el monto de este impuesto en productos que dañan la salud como tabaco, alcohol, bebidas azucaradas y comida chatarra. “El Ejecutivo había enviado una propuesta de actualización con base a la inflación. Sin embargo, ante la emergencia sanitaria que vive el país, estamos proponiendo una actualización no sólo en función de la inflación, sino también en función del impacto a la salud que se vive con estos productos”, dijo Ramírez Cuéllar. Mencionó que un aumento en los impuestos a estos productos permitiría reducir su consumo, lo que tendría un impacto positivo en la salud de los mexicanos. “El uso de los recursos recaudados por estos productos podría servir para aumentar el presupuesto al sector salud”. Otra propuesta que enviarán al Senado de la República es la condonación del 50% de la deuda que tienen los municipios con la Comisión Federal de Electricidad (CFE). El diputado Irineo Molina Espinoza indicó que son alrededor de 6,200 millones de pesos los adeudos en materia eléctrica y lo que buscan hacer es un convenio con la CFE. “Nuestra propuesta es hacer un acuerdo con CFE para que se creé un esquema de pago, en el que los municipios puedan pagar su deuda con base a sus capacidades de ingreso, es decir, en parcialidades, ya sea a través de las participaciones o aportaciones federales”. Comentó que otra medida que ayudará a mejorar las finanzas de los municipios es la reforma que se hizo en el Impuesto Sobre la Renta (ISR) en materia de enajenación de bienes, “de tal manera que todo el producto de la operación de enajenación de bienes se le restituya a las entidades y municipios por un monto de alrededor de 5,000 millones de pesos”. Con respecto a la propuesta de regularizar los autos chocolate, el diputado Ramírez Cuéllar expuso que no ve razón para que exista preocupación “son familias humildes que nunca van a tener dinero para ir a una agencia a comprar un vehículo. Entonces, ellos nunca van a ser clientes de ninguna de las agencias, con lo que no creo que haya mayor afectación, pero está siendo valorado por los Senadores”. A la pregunta de qué pasaría si el Senado cancela la propuesta del cobro del uso del agua y la regulación de los autos chocolate, así como la propuesta en IEPS, respondió: “Yo espero que nos enmienden la plana en materia de IEPS, ahí sí aceptaríamos con gusto que nos corrigieran para que apoyen el sistema de salud y en lo otro, el llamado que les haríamos es que aliviemos la carga pesada que tienen muchos municipios”.   |
16||Morena presentará reservas a la Ley de Ingresos en Senado, adelantó Monreal|                        |
17|23 de octubre de 2019, 21:02|Uso de mariguana, a debate en la Cámara Alta|                     Hasta el momento está pendiente “una estrategia de prevención y educación para el uso responsable de la mariguana; sin embargo, el dictamen para legalizar el cannabis avanza en el Senado de la República. La semana pasada la Cámara Alta difundió el predictamen de la Ley para la Regulación de Cannabis, el cual contempla la creación del Instituto del Cannabis para la Pacificación y Reconciliación del Pueblo, que se prevé se mantenga adscrito a la Secretaría de Gobernación (Segob). De acuerdo con el documento, la regulación legal del uso del cannabis y sus derivados sería bajo el enfoque de salud pública, derechos humanos y desarrollo sostenible, así como para reducir la incidencia delictiva vinculada con el narcotráfico. La ley autorizaría que el consumo fuera con fines lúdicos, personales, médicos e industriales y se prohibiría que las personas menores de 18 años tuvieran acceso al cannabis para uso recreativo. La senadora y presidenta de la Comisión de Juventud, Lucía Meza (Morena), expresó a El Economista que de manera particular está de acuerdo con su legalización para el uso medicinal, pero no para cuestiones lúdicas. “Estoy convencida de que el uso recreativo tiene impactos muy fuertes, sobre todo en las y los jóvenes, ya que la mayoría de las personas que lo consume empieza a hacerlo tanto en la secundaria como en la educación superior. Considero que se debería legalizar a los 21 años su uso lúdico”, opinó la legisladora de Morena. Meza Guzmán indicó que si bien la Suprema Corte fijó al Congreso que se tiene hasta la última semana de octubre para reglamentar el uso recreativo de la mariguana, el predictamen aún debe mejorarse. “El predictamen tiene muchos resquicios y un tema que se debe atender es que si el Estado va a captar entre 1 millón y 2 millones de dólares, que es lo que gana el crimen organizado en el mercado negro por la venta de mariguana, se debe aclarar a dónde se van a destinar esos recursos”. Por su parte, la directora general de CannabiSalud, Lorena Beltrán, opinó que México se encuentra preparado para la legalización del cannabis para todos sus usos. “La falla es que el gobierno no invierte en educación, porque si bien se inició una campaña contra las adicciones en las y los jóvenes, es algo muy superficial. Es hacer conciencia tanto para el gobierno como para las empresas privadas, quienes deberían destinar cierto porcentaje de las ganancias para campañas de consumo responsable”. La también presidenta de la Asociación Mexicana de la Industria Regenerativa del Cannabis destacó la importancia de que la norma contemple las licencias otorgadas a campesinos que se dedican a la siembra de la planta y quienes —dijo— han sido los más afectados por el crimen organizado. Despenalizar el consumo de drogas no necesariamente ayudará a erradicar el crimen organizado y la violencia; se debe analizar la delincuencia organizada como un fenómeno económico, por lo que las estrategias contra estos grupos deben enfocarse en el tema de sus finanzas, consideraron académicos y expertos en políticas sociales. Durante el seminario “La regulación del cannabis y la política de drogas en México”, el doctor en Ciencias Penales y Política Criminal y profesor de la Facultad de Derecho de la UNAM, Pedro José Peñaloza, señaló que pese a que los estudios muestran que la violencia está asociada al tema del tráfico y el trasiego de drogas, en especial a la mariguana, los gobiernos de los últimos 18 años se han resistido a su despenalización. “No podemos decir que si disminuimos o legalizamos el consumo de drogas automáticamente vamos a erradicar la violencia. Lo que va a pasar, en la hipótesis de la despenalización, es que habrá un desplazamiento de la criminalidad, es decir, una vez que se les quite el negocio, estos grupos delictivos no se van a dedicar a una actividad económica productiva, no van a abandonar la actividad criminal (...) Está comprobado que se desplazan a otras morfologías del crimen, robo de autos, secuestros”. Por lo tanto, dijo, es equivocada la idea de que en automático habrá una disminución de la violencia si se despenaliza el consumo de drogas. “La economía del crimen nos muestra que el narcotráfico es un inciso de la delincuencia organizada y en consecuencia estamos en presencia de un fenómeno económico, por lo que no está en la órbita del derecho penal, sino estamos en presencia de la economía del crimen”, agregó. El también abogado y economista consideró que el gobierno se enfrenta a un problema de tejido social, ya que los recientes hechos de violencia suscitados en Culiacán reflejan que hay un fuerte control territorial y de blindaje del Cártel de Sinaloa, característico también de otros grupos delincuenciales como la Familia Michoacana, sobre la población. Con este planteamiento coincidió el investigador y maestro de derecho de la UNAM, Imer Flores Mendoza, quien aseveró que el problema del narcotráfico “está permeando en el tejido social más de lo que nos habíamos dado cuenta”. “Antes podríamos decir que era una excepción. Preocupa que esto ya sea en extensiones muy grandes de territorio (...) y esto podría ser muestra de que el Estado está perdiendo el control territorial”. (Con información de Maritza Pérez)  |
18|23 de octubre de 2019, 10:51|Industria automotriz prevé freno a regularización de autos chocolate en el Senado|         El coordinador de la bancada de Morena en el Senado, Ricardo Monreal, se comprometió con la industria automotriz a eliminar el artículo de la Ley de Ingresos de 2020 y no permitir la regularización de autos “chatarra” que circulan en México, que atentan contra el mercado interno. Así lo adelantó Eduardo Solís, presidente de la Asociación Mexicana de la Industria Automotriz (AMIA), por lo que se prevé que esta semana se apruebe la Ley, excluyendo el artículo transitorio Décimo Quinto y devolverlo a la Cámara de Diputados. “Ricardo Monreal, presidente de la Junta de Coordinación Política del Senado nos ha dado una esperanza y su intención de bajar el artículo transitorio (Décimo Quinto de la Ley de Ingresos) y seguiremos platicando con él y los aliados de la industria automotriz en más de 10 estados de la República”, sentenció Solís. En conferencia de prensa conjunta con el Consejo Coordinador Empresarial (CCE), el representante de las fabricantes de vehículos comentó que hubo pláticas también con Alejandro Armenta, presidente de la Comisión de Hacienda en la Cámara Alta, quien se mostró en contra de la ilegalidad y en favor de seguir impulsando a la industria automotriz que representa un motor para la economía del país. Y es que “sin discusiones ni consultas previas con los sectores involucrados, en la Cámara de Diputados se aprobó un artículo transitorio a la Ley de Ingresos de la Federación para el 2020, y en la que con argumentos populistas, de seguridad nacional y cifras falsas, se le autorizó al Congreso para emitir normatividad que permita regularizar los autos 'chocolates' en el país", dijo el líder de los distribuidores de automotores, Guillermo Prieto. erp  |
19|21 de octubre de 2019, 12:30|PRI reclama a Morena y aliados por aprobación de Ley de Ingresos |               Los únicos responsables de la "crisis económica que está en el horizonte" serán el partido Movimiento Regeneración Nacional (Morena) y sus aliados del PT, PES y PVEM, por aprobar una Ley de Ingresos para el próximo año que no cumple ni atiende las necesidades que enfrenta el país, advirtió el presidente del Comité Ejecutivo Nacional del PRI, Alejandro Moreno Cárdenas. "Morena está dejando en el desamparo a quienes menos tienen y más van a sufrir con la recesión económica que se acerca… La Ley de Ingresos aprobada por Morena es reflejo de una política económica irresponsable destinada al fracaso, con una recaudación de impuestos voraz que afecta la economía de los que menos tienen", dijo. Moreno Cárdenas advirtió que el poco crecimiento económico con que concluirá el presente año y con el que finalizará el 2020 será una consecuencia provocada por malas decisiones. "Las expectativas de crecimiento para el próximo año son, más que optimistas, ilusorias, pues no están sustentadas en una base real y son contrarias a las estimaciones de especialistas y calificadoras. "Así lo anunció en días recientes Moody’s, que redujo la expectativa de crecimiento del 2020 de 1.5% a 1.3%, lo cual coincide con las reducciones que semanas antes habían hecho públicas otras instancias como el Fondo Monetario Internacional (FMI), el Banco Mundial (BM) y el Banco de México (Banxico)", señaló. En opinión del campechano, las perspectivas del gobierno federal sobre producción petrolera y precios del petróleo para el próximo año son meras fantasías y criticó que se comprometan recursos que aún no se tienen. "De cada 100 pesos que el gobierno invertirá en infraestructura 50 son para la empresa petrolera y se abandonan otras inversiones públicas estratégicas, con más futuro, y se presiona a (Petróleos Mexicanos) Pemex que, de fracasar su plan de negocios, será la empresa la que asuma todo el costo de las malas decisiones". Las expectativas de recaudación del Impuesto al Valor Agregado (IVA) e Impuesto Sobre la Renta (ISR) son también irreales, amplió, ya que en el presente año disminuyó 11% y 3%, respectivamente, en relación con el 2018. "No salen las cuentas. Sólo se entiende tanto optimismo en la política de terrorismo fiscal que se implementará", aseguró. Moreno Cárdenas anunció que el grupo parlamentario del PRI en la Cámara de Senadores, donde se discutirá y votará ahora el paquete económico en materia de ingresos una vez que ha sido aprobado por la Cámara Baja, insistirá en los cambios propuestos a la miscelánea fiscal por los diputados federales priistas y que no prosperaron. "Rechazamos cualquier intento de manipular a los ciudadanos y de convencerlos de que vamos bien y que los errores de hoy son responsabilidad de administraciones pasadas", concluyó el priista. rramos@eleconomista.com.mx  |
20|19 de octubre de 2019, 09:45|PRI presenta acción de inconstitucionalidad contra la Ley Bonilla de Baja California|             El Partido Revolucionario Institucional (PRI), a través de Alejandro Moreno Cárdenas, presentó ante la Suprema Corte de Justicia de la Nación (SCJN), una acción de inconstitucionalidad contra la llamada “Ley Bonilla”, cuya reforma constitucional permitirá al morenista Jaime Bonilla Valdéz gobernar Baja California por un periodo de cinco años, en vez del de dos para el que fue electo. “Sin lugar a dudas, violenta todo el proceso legal, democrático, para una elección de gobernador que fue mandatada por el pueblo de Baja California para dos años”, afirmó el presidente del Comité Ejecutivo Nacional del partido tricolor tras entregar la documentación jurídica correspondiente ante el máximo tribunal del país. Con el recurso legal, explicó el campechano, se pretende dejar en claro que se tienen que respetar las libertades y el derecho de todos y cada uno de los mexicanos a votar en libertad, las instituciones y el estado de Derecho. Su partido siempre se ha pronunciado por fortalecer las instituciones democráticas, acotó. El CEN del PRI estará atento al fallo de la Corte, mediante su área jurídica, informó, porque el pueblo bajacaliforniano eligió un mandato de dos años y ahora se pretende, por un camino que no es el democrático, ampliarlo a cinco años.  Ese es el argumento y “lo hemos presentado con mucha claridad”, precisó. Respecto de los hechos de violencia que se registraron en Culiacán, Sinaloa, el pasado jueves, que lamentó, estableció que el gobierno federal, “sin lugar a dudas, tiene que ajustar la estrategia de seguridad". “La estrategia no ha dado resultados, y lo que exigimos del gobierno es que den resultados, que garanticen paz y seguridad al pueblo de México”. Finalmente, Moreno Cárdenas comentó que para los priistas lo más importante es estos tiempos es la seguridad, paz y armonía que deben tener las familias mexicanas.  rramos@eleconomista.com.mx  |
