Id|Date|Title|Text|
0|06 de noviembre de 2019, 20:46|INE sanciona a nueve partidos políticos con 586 millones de pesos| Nueve partidos políticos nacionales y partidos locales, fueron sancionados por un monto de 586 millones de pesos por el Consejo General del Instituto Nacional Electoral (INE) al aprobar el proyecto de dictamen y resolución sobre las irregularidades encontradas en la revisión de los Informes Anuales de Ingresos y Gastos, que presentan los partidos de los recursos que recibieron y ejercieron en 2018, tanto a nivel local, como federal. La sanciones giran en torno a 43 conductas distintas, de las cuales las más reiterativas son las cuentas por cobrar con antigüedad mayor a un año -con una sanción total de 118.48 millones de pesos-, y las cuentas por pagar con una antigüedad mayor a un año -con una sanción de 111.14 millones de pesos-. Benito Nacif, presidente de la Comisión de Fiscalización, informó que la auditoría que realizó el INE abarcó recursos por un total de 33,500 millones de pesos aproximadamente, los cuales fueron ejercidos por partidos políticos en este ejercicio ordinario de 2018: 17,000 millones de pesos de ingresos y 16,500 millones de pesos de egresos. En total, el INE fiscalizó 33,500 millones de pesos a través de 627 informes. Se indicó que  99.9% de los gastos de los partidos fue reportado. El instituto político más sancionado fue Morena con 238.8 millones de pesos en multas; seguido del PAN, con una sanción de 69 millones de pesos y el PRD, al cual el INE le impuso una multa de 65.5 millones de pesos por irregularidades en su fiscalización. El consejero presidente del INE Lorenzo Córdova destacó que 68% de las sanciones que propuso la Comisión de Fiscalización corresponden a faltas cometidas por las representaciones locales de los partidos políticos nacionales, mientras que únicamente el 32% deriva de faltas atribuibles a los comités ejecutivos nacionales. kg  |
1|05 de noviembre de 2019, 19:29|Senadores aplazan otra vez la votación para designar a titular de la CNDH|          El Pleno del Senado de la República aprobó retirar del orden del día de este martes 5 de noviembre la tercera votación de la terna para designar al próximo titular de la Comisión Nacional de Derechos Humanos (CNDH), por lo que se pospuso hasta la próxima sesión que se realizará este jueves. Pese a la exigencia de la oposición de la Cámara Alta de cumplir con el acuerdo del pasado 30 de octubre por el que se tenía que votar por tercera vez la terna compuesta por Rosario Piedra, José de Jesús Orozco y Arturo Peimbert, con 66 votos a favor y 29 en contra se aprobó retirar la votación de este martes. La solicitud de posponer el proceso de elección fue realizada por el presidente de la Comisión de Justicia del Senado, Julio Menchaca de Morena, bajo el argumento de contar con mayor tiempo para alcanzar un consenso entre las distintas bancadas. Sin embargo, tanto Acción Nacional (PAN), como Movimiento Ciudadano (MC) y el senador independiente, Emilio Álvarez solicitaron que se respetará el acuerdo y se sometiera a votación la terna. En su intervención, Álvarez Icaza recordó que el periodo del actual presidente de la Comisión Luis Raúl González Pérez, concluye el próximo 15 de noviembre y advirtió que de acuerdo con la Ley de la CNDH, el Senado debe asignar al próximo titular del organismo diez días antes de la conclusión de la administración de González Pérez. En ese sentido, el senador aseguró que la Cámara Alta no está acatando la ley de la CNDH al incumplir con el plazo establecido. kg  |
2|05 de noviembre de 2019, 14:56|Senadores rechazan nuevamente regular autos chocolate|               Los senadores volvieron a decir no al artículo transitorio que la Cámara de Diputados añadió a la Ley de Ingresos de la Federación (LIF) para el 2020, con el cual buscaba regular los denominados autos chocolate que transitan en el país. Durante la tarde del martes, la Cámara Alta votó con tres votos a favor, 108 en contra y cero abstenciones el artículo decimoquinto transitorio, con lo cual queda definitivamente descartado. La discusión se llevó sin participantes y los senadores pasaron a votar en cuestión de minutos. El artículo transitorio fue propuesto por Morena en dos ocasiones durante su discusión en la Cámara de Diputados, mientras que en el Senado la bancada de Morena y otros grupos parlamentarios votaron en contra de dicho transitorio. “Senadores y senadoras de la República, esta es una problemática real y que debemos enfrentar como representantes populares; atenderla, no evadirla; ser sensibles con las familias que no han tenido las condiciones económicas para adquirir un automóvil nacional y que han optado con sus pocos ahorros y mucho esfuerzo por comprar un automóvil chocolate, ya que ha sido esta la opción más económica disponible”, indicó Teresita de Jesús Vargas, de Morena, la semana pasada. No obstante, el lunes pasado Ricardo Monreal, senador de Morena, adelantó que el artículo transitorio se eliminaría. “Es previsible que en la Cámara de Senadores, porque me lo han dicho los coordinadores, mantengan su postura de eliminar el referido decimoquinto transitorio”. Con lo aprobado este martes, el Senado remite al Ejecutivo federal la ley de ingresos para el siguiente año con lo aprobado por ambas cámaras. Ahora, se esperará su publicación en el Diario Oficial de la Federación. Lo aprobado por ambas cámaras prevé que el próximo año el gobierno obtenga recursos por 6 billones 107,732 millones de pesos, lo que supone 11,396 millones de pesos más respecto a la propuesta que entregó la Secretaría de Hacienda y Crédito Público en septiembre pasado, que era por 6 billones 96,335 millones. Si bien el tema de los autos chocolate quedó fuera de la LIF, en días pasados Ricardo Monreal indicó que pedirán a las autoridades que tomen acciones para solucionar este problema. “El problema es serio, y como Cámara revisora tenemos que actuar con mucha prudencia, para mantener la planta productiva y para mantener la industria en acenso”, aseguró. Agregó que le plantearían tanto a la Secretaría de Hacienda como al Servicio de Administración Tributaria que estos vehículos que ya circulan en México puedan ser regularizados y, de esta manera, paguen impuestos, tengan una identificación y un número de placas. Desde que se anunció la medida, miembros de la industria automotriz se quejaron, ya que preveían un impacto en la venta de automóviles nuevos y refirieron que el erario público tendría una pérdida recaudatoria de aproximadamente 50,000 millones de pesos. “Muchos empleos están en juego. El crecimiento de la economía está en juego, y lo que no podemos, lo seguiremos repitiendo hasta el cansancio, es legalizar lo ilegal”, aseveró en su momento Guillermo Prieto, presidente de la Asociación Nacional de Distribuidores de Automotores.  |
3||Con impugnaciones, arranca gobierno de Bonilla|                                  |
4|03 de noviembre de 2019, 15:48|Morena no pasó la prueba del ácido| Morena no pasó su primera prueba de fuego, el Tribunal Electoral del Poder Judicial de la Federación (TEPJF) invalidó la convocatoria para renovar la dirigencia nacional.  Yeidckol Polevnsky fue incapaz de organizar una elección apegada al marco estatutario de su partido, el TEPJE consideró que Morena violentó el derecho de asociación de los simpatizantes y adherentes de su partido al cerrar la incorporación al padrón. En sus tres años de vida política fue capaz de ganar la presidencia de la república, pero no pudo elaborar un padrón confiable, tarea que le fue impuesta el exsecretario de organización de ese partido Gabriel García, del mismo que hoy dependen los servidores públicos de la nación. Dicha estructura es la apuesta del presidente Andrés Manuel López Obrador para retener las mayorías en el Congreso y lograr los votos necesarios en la polémica revocación del mandato. La dirigencia encabezada por Polevnsky no pasó la prueba del ácido de la democracia partidista, fue incapaz de salvaguardar los derechos de sus asociados para renovar su dirigencia partidista, así como de elaborar un padrón validado por el Instituto Nacional Electoral (INE).  Las voces en Morena, entre ellas la de Bertha Luján, insinúan que hubo mano de negra en la resolución número SUPRA 1573/2019, promovida entre otros por el senador suplente Alejandro Rojas Díaz Duran; sin embargo, la resolución es muy clara, no se pueden suspender los derechos de libre afiliación y libre asociación, son derechos humanos establecidos en la constitución, que no están al arbitrio de partido político alguno. Sería útil que la dirigencia acate la decisión del TEPJF y se ponga a trabajar en elaborar un padrón partidista confiable. De lo contrario muchos reveses sufrirá su proceso de renovación partidista, sobre todo considerando la propensión de su militancia para interponer recursos jurídicos ante el Tribunal Electoral. El senador suplente Alejandro Rojas Díaz Duran logró evidenciar las triquiñuelas de la nomenclatura morenista en su afán por conservar la dirigencia nacional. La nomenclatura se muestra fracturada, Polevnsky tuvo fricciones con todos los que pudo, fueron notables sus diferencias con Mario Delgado, con Bertha Luján y su antiguo empleado Gabriel García. Habrá que esperar qué se decide para rescatar ese partido, alternativas hay muchas, lo que no se ve son ganas abrir espacios democráticos. El brazo político de AMLO nomás no termina de despegar. El mismo AMLO amenazó con irse de su partido ante el agandalle morenista ¿será que quiera hacer otro? El caos político se cierne sobre Morena.  |
5||El TEPJF actuó por consigna al revocar elección interna en Morena: Bertha Luján|                             |
6||Nuevos ingresos de trabajadores en el gobierno de la CDMX ya no serán sindicalizados |                |
7|29 de octubre de 2019, 22:55|Al pleno, recorte de 50% a bolsa para los partidos|               La Cámara de Diputados aprobó, en comisiones, la reforma constitucional que reduciría a la mitad el financiamiento público asignado a los partidos políticos con registro nacional; el dictamen se someterá a discusión y votación por parte del pleno cameral la próxima semana. El cambio al Artículo 41 constitucional fue avalado, en reunión de la Comisión de Puntos Constitucionales, solamente por 17 legisladores de los grupos parlamentarios de los partidos Movimiento Regeneración Nacional (Morena), la fuerza política mayoritaria, y Encuentro Social (PES); 14 panistas, priistas, perredistas, emecistas y hasta los pevemistas y petistas, que son los aliados del régimen, sufragaron en contra. Ello implica que la aprobación del decreto correspondiente no está garantizada en la Cámara Baja porque, al tratarse de una reforma constitucional, se requiere del voto de las dos terceras partes de los legisladores presentes al momento de su votación; es decir, de encontrarse en el recinto legislativo los 500 integrantes de la Cámara Baja se necesitaría el voto de 334 diputados federales a favor. Los diputados federales de Morena y PES sólo suman 284; 258 son morenistas y 26 pesistas. El Consejo General del Instituto Nacional Electoral aprobó destinar, en el 2020, 5,239 millones de pesos por concepto de financiamiento público a los siete partidos políticos nacionales con registro; la cifra es superior en 273 millones de pesos a lo asignado para el año en curso. De aprobarse el cambio constitucional referido, primero por las cámaras de Diputados y de Senadores y luego por al menos 17 congresos locales, la enmienda constitucional establecerá que el financiamiento público para el sostenimiento de las actividades ordinarias permanentes de los partidos políticos “se fijará anualmente, multiplicando el número total de ciudadanos inscritos en el padrón electoral” por 32.5% del valor diario de la Unidad de Medida y Actualización (UMA), antes salario mínimo diario. La fracción segunda, inciso a), del referido artículo vigente precisa que el monto de dicho financiamiento público resultará de multiplicar el número de empadronados por 65% del valor de la UMA. La distribución actual del financiamiento público no sufrirá modificación alguna: 30% del monto se seguirá distribuyendo entre los partidos políticos en forma igualitaria y 70% restante de acuerdo con el porcentaje de votos obtenido en la elección de diputados federales inmediata anterior. Aprobado el cambio constitucional, el Congreso de la Unión y las legislaturas de las entidades federativas contarían con un plazo no mayor de 60 días naturales, contabilizado a partir del día siguiente de su promulgación, para realizar las modificaciones normativas correspondientes, entre otras a la Ley General de Partidos Políticos. “En conclusión, esta comisión dictaminadora considera que, con este modelo constitucional en materia de financiamiento de partidos políticos, se disminuyen los recursos de origen público para dichos institutos, se incentiva el uso racional de los recursos y la confianza ciudadana, consiguiendo un sistema electoral que se adecue más a la realidad económica de nuestro país”, cita la exposición de motivos. Y que la enmienda tiene como finalidad generar ahorros al erario público. politica@eleconomista.mx  |
8||Por delitos graves, juicio al presidente|                      |
9|29 de octubre de 2019, 22:39|Ataque armado contra alcalde de Valle de Chalco|               Luego de sufrir un ataque armado directo, el presidente municipal de Valle de Chalco, Estado de México, Francisco Tenorio Contreras (Morena), fue reportado como grave de salud. De acuerdo con el fiscal del Estado de México, Alejandro Gómez Sánchez, el alcalde Tenorio Contreras concluía un recorrido por un fraccionamiento habitacional del municipio, cuando un par de jóvenes le pidieron al funcionario una fotografía, la cual se tomaron. Posteriormente, el munícipe, su secretario particular, Carlos Alberto y el chofer subieron a una camioneta, hasta donde se acercó uno de los dos jóvenes con los que Tenorio se había tomado una fotografía, ahora para pedir un aventón. Al reconocerlo, el alcalde accedió a subirlo al vehículo y continuaron la marcha, pero unos metros adelante el joven pidió que tomaran por una calle, situación que rechazó el edil. En ese momento, el joven accionó una arma de fuego directamente hacia la cabeza de Tenorio Contreras, y luego contra su secretario particular. Tras reponerse del suceso, el chofer condujo hacia el hospital Fernando Quiroz de Chalco, y posteriormente se trasladó a otro de alta especialidad de Ixtapaluca, donde el estado de salud del alcalde se reportaba como grave. El fiscal del Estado de México, Alejandro Gómez Sánchez, confirmó que las fotografías que circularon en redes sociales corresponden a los agresores del edil y su secretario particular. El gobernador Alfredo del Mazo condenó el ataque y ordenó agilizar las investigaciones. Elementos de la fiscalía estatal levantaron imágenes de las cámaras de seguridad cercanas a los hechos y realizaron estudios de dactiloscopía. El fiscal confirmó que el alcalde había recibido amenazas de muerte, por lo que no se descarta ninguna línea de investigación. La falta de tareas de inteligencia preventivas para proteger a los políticos de nivel local preocupa y refleja la vulnerabilidad que éstos tienen ante las agresiones y amenazas de las que pueden ser víctimas, consideró Rubén Salazar, director de la consultoría de riesgos Etellekt. En relación con el reciente ataque contra el presidente municipal de Valle de Chalco, Francisco Tenorio Contreras, el experto en violencia contra políticos recordó que el edil ya había denunciado amenazas por parte de grupos de la delincuencia organizada. “Ya tenían una situación de amenaza desde el 1 de marzo por parte de grupos delictivos, él denuncio públicamente que estaba siendo objeto de extorsión y amenazas de muerte y la pregunta es ¿qué está haciendo la autoridad para prevenir que estos atentados terminen con la vida de autoridades electas cuando ya se tenía información de que estaban siendo amenazados?”, cuestionó Salazar. El director de Etellekt agregó que actualmente no sólo los grupos de la delincuencia organizada son los generadores de las agresiones y amenazas contra políticos, porque los patrones de los ataques han reflejado que la mayor parte de los políticos agredidos son de oposición a los partidos que gobiernan a nivel estatal, lo que podría indicar la existencia de mafias políticas locales que también generan este tipo de violencia. Además, agregó, llama la atención que en un año que no tiene carga electoral se contabilicen por lo menos cinco alcaldes asesinados, dos de ellos amenazados de manera previa, lo que indica una tendencia preocupante y refleja la vulnerabilidad que tienen las autoridades a nivel local, aunado a una debilidad en sus esquemas de seguridad. “Las labores de inteligencia en estos casos ya llevan varios años, donde no se reflejan en tareas o acciones preventivas. Ninguno de estos alcaldes, aun cuando ya se sabe que habían sido amenazados, algunos incluso desde hace años, logran acceder a protocolos o medidas cautelares de protección, como ocurre con otros sectores como los periodistas”, expuso.  |
10|29 de octubre de 2019, 17:27|Diputados aprueban que el Presidente pueda ser acusado por diversos delitos graves| Con 420 votos a favor, 29 en contra y cinco abstenciones, el pleno de la Cámara de Diputados aprobó la minuta en materia de fuero constitucional para que el Ejecutivo federal pueda ser juzgado por delitos electorales y de corrupción, así como por otros ilícitos graves. La Cámara de Diputados devolvió al Senado, con cambios, la minuta de reforma constitucional. El diputado federal Pablo Gómez, de Morena, destacó que "con esta reforma de la Carta Magna se termina el esquema de impunidad que actualmente protege al presidente de la República, que impide que durante el tiempo de su encargo sea procesado o sentenciado penalmente”. Detalló que la reforma al Artículo 108 constitucional incluye todo acto de corrupción previsto en el Código Penal como ejercicio ilícito del servicio público. En igual caso se encuentran los casos relacionados con abuso de autoridad, coalición de servidores públicos, uso ilícito de atribuciones y facultades, delitos por pago y recibo de remuneraciones de los servidores públicos, intimidación, ejercicio abusivo de funciones, tráfico de influencia, cohecho, cohecho a servidores públicos, peculado y enriquecimiento ilícito. “Cualquiera de esas (anteriores) conductas que caracterizaron la gestión presidencial durante muchos sexenios, eso es lo que estamos ajustando", dijo el legislador. "Estamos ajustando cuentas con la historia y haciendo ver que eso de lo que siempre nos quejábamos de los presidentes, ahora podrá ser perseguido ya contra el presidente en turno”, dijo Pablo Gómez y recordó que además se trata de una promesa de campaña del presidente Andrés Manuel López Obrador.  El presidente de la Junta de Coordinación Política del órgano legislativo, Mario Delgado, remarcó que con esa reforma se busca que el Presidente pueda ser juzgado por delitos de corrupción, electorales e ilícitos considerados en el Artículo 19 constitucional. Dijo que “el 108 constitucional era muy restrictivo respecto de los delitos en los que el presidente de la República en funciones pudiera ser juzgado como era explícitamente traición a la patria y otros delitos del orden común”. El también diputado por Morena enfatizó que con la aprobación de la minuta se da un paso importante para quitar la inmunidad al ejecutivo federal y en San Lázaro se avanza hacia una redefinición completa del sistema político mexicano. Adelantó que la semana próxima, cuando se vote la revocación de mandato, consulta popular, fuero constitucional y condonación fiscal por parte del Ejecutivo “vamos a cambiar por completo la figura del presidente de la República”. Lo anterior, resumió, “dado que tendrá responsabilidad política, a través de la revocación de mandato y consulta popular, responsabilidad penal, en el ejercicio que podrá ser el Congreso para destituirlo en caso de que cometa un ilícito y, responsabilidad fiscal, al renunciar a la facultad de condonar de manera discrecional impuestos”. En torno al tema del fuero, la presidenta de la Cámara de Diputados, Laura Rojas, recordó que se trata de una iniciativa que presentó López Obrador para que el mismo Ejecutivo federal pueda ser procesado y desaforado en caso de que cometa un delito grave. Rojas Hernández consideró en tal sentido que todo lo que tenga que ver con fortalecer las condiciones de rendición de cuentas de cualquier funcionario público es adecuado. kg  |
11|29 de octubre de 2019, 16:15|Senadores de Morena respaldan a 10 aspirantes a la presidencia de la CNDH|           El coordinador parlamentario de Morena en el Senado de la República, Ricardo Monreal, informó que de los 56 aspirantes a presidir la Comisión Nacional de Derechos Humanos (CNDH), su partido ha considerado a diez de ellos para ocupar el cargo. Explicó que de esos diez nombres saldrá la posible terna que se someterá a consideración del Pleno integrada por las personas que resultaron con mayor aptitud ante las Comisiones Unidas de Derechos Humanos y Justicia del Senado. “En el grupo parlamentario hay distintas voces por los perfiles, tenemos mucha dispersión en el grupo. Y si la tengo adentro, imagínense afuera con los grupos parlamentarios; requerimos mayoría calificada”, declaró Monreal Ávila. Aseguró que la designación del nuevo presidente de la CNDH ha sido un proceso difícil por la importancia del cargo, además de los intereses y recomendaciones de los aspirantes. Ricardo Monreal afirmó que el próximo titular del Comisión Nacional debe ser un hombre o una mujer alejada del poder público, sin relación con actores políticos, y que sea autónoma e independiente. Entre los nombres que respalda Morena en el Senado se encuentran, Rosario Piedra, integrante del Comité ¡Eureka! e hija de la defensora de derechos humanos, Rosario Ibarra de Piedra; Ricardo Bucio, secretario Ejecutivo del Sistema Nacional de Protección Integral de Niñas, Niños y Adolescentes (Sipinna); Rosalinda Salinas exsegunda visitadora de la Comisión de Derechos Humanos del Distrito Federal (CDHDF); Michael Chamberlin y Rosy Laura Castellanos con experiencia en el Consejo Consultivo de la CNDH. Asimismo, Arturo Peimbert, ex titular de la Defensoría de los Derechos Humanos del Pueblo de Oaxaca; Juan Manuel Estrada Juárez, ganador del Premio Nacional de Derechos Humanos 2014; Elizabeth Lara, quien se ha desempeñado como coordinadora en materia migratoria de la CNDH en Oaxaca y fue propuesta al presidente Andrés Manuel López Obrador por Alejandro Solalinde. Finalmente, José de Jesús Orozco, ex comisionado de la Comisión Interamericana de Derechos Humanos (CIDH) y Carlos Pérez Vázquez quien se desempeñó como coordinador de Derechos Humanos de la Suprema Corte de Justicia de la Nación.  |
12|28 de octubre de 2019, 16:39|Morena buscará impulsar recuperación de salario desde el Legislativo: Martí Batres|           La recuperación salarial en el país también estará impulsado desde el Legislativo que busca dar una base, pues se trata de contar con ciertas bases mínimas,que se conviertan en un marco infranqueable, dijo Martí Batres, senador del grupo parlamentario de Morena, quien encabezó el foro "El aumento al salario mínimo y la estrategia legislativa”. Este foro se suma a los análisis que realiza la Comisión Nacional de Salarios Mínimos (Conasami) de cara a la próxima revisión que deberá aprobarse en el mes de diciembre, y del que se espera esta semana realice la sesión del Consejo de Representantes. En ese sentido, el senador Batres dijo que se está planteando un par de reformas a la Ley Federal del Trabajo, una reforma al Artículo 85 y otra al Artículo 90. “En el caso del Artículo 85, estamos planteando que, para fijar el importe del salario mínimo, se tomarán en consideración la cantidad y calidad del trabajo y agregamos, también, el monto del índice inflacionario del año inmediato anterior al que corresponda fijar el salario mínimo vigente, y la inflación proyectada para el año de que se trate, según las cifras oficiales del Banco de México, esto, como un criterio general”, detalló. Además, en el Artículo 90, como un criterio específico, “estamos planteando que el incremento del salario mínimo vigente en el país nunca estará por debajo de la proyección inflacionaria del año que inicie, emitida por el Banco de México”. pmartinez@eleconomista.mx   kg  |
